{
  "schemaVersion": "custom_millwork.release_evidence.v2",
  "generatedAt": "2026-07-10T00:00:00+08:00",
  "releaseCandidate": {
    "id": null,
    "buildCommit": null,
    "environment": null,
    "baseUrl": null
  },
  "usabilityScenarios": [
    { "id": "A", "label": "First-time designer — two-minute base cabinet", "status": "not_run", "evidence": null },
    { "id": "B", "label": "Intermediate designer — 3000 mm wardrobe", "status": "not_run", "evidence": null },
    { "id": "C", "label": "Professional designer — fitted media wall", "status": "not_run", "evidence": null },
    { "id": "D", "label": "Error recovery", "status": "not_run", "evidence": null },
    { "id": "E", "label": "Returning designer — reopen and edit", "status": "not_run", "evidence": null }
  ],
  "templateFirstTimeChecks": [
    { "id": "base-cabinet", "label": "Base cabinet", "status": "not_run", "evidence": null },
    { "id": "wall-cabinet", "label": "Wall cabinet", "status": "not_run", "evidence": null },
    { "id": "tall-cabinet", "label": "Tall cabinet", "status": "not_run", "evidence": null },
    { "id": "wardrobe", "label": "Wardrobe", "status": "not_run", "evidence": null },
    { "id": "vanity", "label": "Vanity", "status": "not_run", "evidence": null },
    { "id": "tv-console", "label": "TV console", "status": "not_run", "evidence": null },
    { "id": "cabinet-run", "label": "Cabinet run", "status": "not_run", "evidence": null },
    { "id": "closet-system", "label": "Closet system", "status": "not_run", "evidence": null },
    { "id": "media-wall", "label": "Media wall", "status": "not_run", "evidence": null },
    { "id": "mudroom-storage", "label": "Mudroom storage", "status": "not_run", "evidence": null },
    { "id": "laundry-room", "label": "Laundry room", "status": "not_run", "evidence": null },
    { "id": "home-office-built-in", "label": "Home office built-in", "status": "not_run", "evidence": null },
    { "id": "library-wall", "label": "Library wall", "status": "not_run", "evidence": null },
    { "id": "window-seat", "label": "Window seat", "status": "not_run", "evidence": null },
    { "id": "banquette", "label": "Banquette", "status": "not_run", "evidence": null },
    { "id": "murphy-bed", "label": "Murphy bed", "status": "not_run", "evidence": null },
    { "id": "fold-down-desk", "label": "Fold-down desk", "status": "not_run", "evidence": null },
    { "id": "platform-storage-bed", "label": "Platform storage bed", "status": "not_run", "evidence": null },
    { "id": "under-stair-storage", "label": "Under-stair storage", "status": "not_run", "evidence": null },
    { "id": "room-divider-storage", "label": "Room divider storage", "status": "not_run", "evidence": null },
    { "id": "home-bar", "label": "Home bar", "status": "not_run", "evidence": null },
    { "id": "kitchen-island", "label": "Kitchen island", "status": "not_run", "evidence": null },
    { "id": "pantry-system", "label": "Pantry system", "status": "not_run", "evidence": null },
    { "id": "wine-storage", "label": "Wine storage", "status": "not_run", "evidence": null },
    { "id": "pet-built-in", "label": "Pet built-in", "status": "not_run", "evidence": null },
    { "id": "kids-storage", "label": "Kids storage", "status": "not_run", "evidence": null },
    { "id": "hobby-storage", "label": "Hobby storage", "status": "not_run", "evidence": null },
    { "id": "wall-paneling", "label": "Wall paneling", "status": "not_run", "evidence": null },
    { "id": "slat-wall", "label": "Slat wall", "status": "not_run", "evidence": null },
    { "id": "ceiling-beams", "label": "Ceiling beams", "status": "not_run", "evidence": null },
    { "id": "coffered-ceiling", "label": "Coffered ceiling", "status": "not_run", "evidence": null },
    { "id": "fireplace-surround", "label": "Fireplace surround", "status": "not_run", "evidence": null },
    { "id": "trim-package", "label": "Trim package", "status": "not_run", "evidence": null }
  ],
  "releaseGates": [
    { "id": "consumer-access-smoke", "label": "Consumer / Free access smoke", "status": "not_run", "evidence": null },
    { "id": "pro-access-smoke", "label": "Pro access and workspace smoke", "status": "not_run", "evidence": null },
    { "id": "guided-quick-start-smoke", "label": "Guided 18-step quick-start smoke", "status": "not_run", "evidence": null },
    { "id": "full-manual-smoke", "label": "Full 41-step manual smoke", "status": "not_run", "evidence": null },
    { "id": "final-ux-release-gate", "label": "Final UX release-gate observation", "status": "not_run", "evidence": null },
    { "id": "full-browser-suite", "label": "Full cabinetry browser acceptance suite", "status": "not_run", "evidence": null },
    { "id": "keyboard-screen-reader-smoke", "label": "Release-candidate keyboard and screen-reader smoke", "status": "not_run", "evidence": null },
    { "id": "live-analytics-consumer", "label": "Live Consumer analytics verification", "status": "not_run", "evidence": null },
    { "id": "live-analytics-pro", "label": "Live Pro analytics verification", "status": "not_run", "evidence": null },
    { "id": "glb-export-fabricator-review", "label": "GLB, project exports, and fabricator review", "status": "not_run", "evidence": null }
  ],
  "approval": null
}
